{
  "version": "1.0",
  "campaign_id": "bordereta-growth-batch-01",
  "concept_id": "reaction-demo-001",
  "reference_id": "reference-creative-001",
  "format": "ugc_reaction_demo",
  "duration_seconds": 17.5,
  "aspect_ratio": "9:16",
  "hook": "I cross the border all the time and somehow missed this.",
  "angle": "surprise + utility proof",
  "script": "Wait, why did nobody tell me this existed? I can compare the bridges before I leave and pick the one that makes sense right now.",
  "creator_id": "creator-a",
  "rights_mode": "creative_dna_only",
  "language": "en",
  "cta": "Check BorderETA before your next crossing.",
  "caption_style": "clean kinetic subtitles",
  "quality_tier": "standard",
  "max_render_cost_usd": 6,
  "tags": ["reaction", "app-demo", "utility"],
  "shots": [
    {
      "id": "s1",
      "start": 0,
      "end": 2.4,
      "source_type": "creator_generated",
      "purpose": "hook reaction",
      "dialogue": "Wait, why did nobody tell me this existed?",
      "visual_direction": "Natural phone-camera framing. Creator reacts with genuine surprise, then looks toward the app demonstration.",
      "capture_script": null,
      "motion_reference_id": null,
      "asset_reference_ids": [],
      "provider_preference": null,
      "provider_fallback": null,
      "required_capabilities": ["image_to_video"]
    },
    {
      "id": "s2",
      "start": 2.4,
      "end": 8.8,
      "source_type": "app_capture",
      "purpose": "show bridge comparison",
      "dialogue": null,
      "visual_direction": "Use real app UI. No generative reconstruction.",
      "capture_script": "Launch app; show bridge comparison cards; scroll once; select the fastest current option.",
      "motion_reference_id": null,
      "asset_reference_ids": [],
      "provider_preference": "local",
      "provider_fallback": null,
      "required_capabilities": ["app_capture"]
    },
    {
      "id": "s3",
      "start": 8.8,
      "end": 11.4,
      "source_type": "creator_generated",
      "purpose": "creator payoff",
      "dialogue": "That is literally what I needed.",
      "visual_direction": "Small nod and relieved smile. Keep performance understated.",
      "capture_script": null,
      "motion_reference_id": null,
      "asset_reference_ids": [],
      "provider_preference": null,
      "provider_fallback": null,
      "required_capabilities": ["image_to_video"]
    },
    {
      "id": "s4",
      "start": 11.4,
      "end": 15.4,
      "source_type": "app_capture",
      "purpose": "show route decision",
      "dialogue": null,
      "visual_direction": "Real route/result UI with a clear final state.",
      "capture_script": "Open selected option; show ETA and route summary; hold final screen for 1.5 seconds.",
      "motion_reference_id": null,
      "asset_reference_ids": [],
      "provider_preference": "local",
      "provider_fallback": null,
      "required_capabilities": ["app_capture"]
    },
    {
      "id": "s5",
      "start": 15.4,
      "end": 17.5,
      "source_type": "graphic",
      "purpose": "CTA",
      "dialogue": null,
      "visual_direction": "Simple CTA card composed in post.",
      "capture_script": null,
      "motion_reference_id": null,
      "asset_reference_ids": [],
      "provider_preference": "local",
      "provider_fallback": null,
      "required_capabilities": []
    }
  ]
}
